{
  "schema_version": 1,
  "read_only": true,
  "refresh_seconds": 30,
  "price_history_seconds": 30,
  "candle_interval_seconds": 60,
  "prices": {"BTC": 100.0, "SOL": 50.0, "XLM": 1.0, "HYPE": 25.0, "ETH": 75.0},
  "price_history": {"BTC": [98.0, 99.0, 100.0]},
  "candles": {
    "BTC": [
      [1700000000, 98.0, 101.0, 97.0, 100.0, 4.0],
      [1700000060, 100.0, 102.0, 99.0, 101.0, 8.0]
    ]
  },
  "positions": {
    "BTC": {"open": true, "side": "long", "contracts": 1.0, "entry": 90.0, "pnl": 10.0}
  },
  "portfolio": {"positions_value": 100.0, "unrealized_pnl": 10.0, "realized_pnl_today": 0.0},
  "closed_today": []
}
